{
  "$schema": "http://json-schema.org/draft-07/schema#",
  "title": "Message de Repas vers l'agent du drive (protocole v1) : plan et setup",
  "description": "Source de vérité documentaire (architecture.md § 8 du dépôt back). Les validateurs de drive-agent/protocol font foi à l'exécution ; un test vérifie qu'ils donnent le même verdict que ce schéma. Ce que JSON Schema ne sait pas dire (identifiants de produit sans doublon dans products et dans rejected, aucun produit à la fois dans products et dans rejected, ingredientSlug uniques entre les lignes) n'est vérifié que par les validateurs.",
  "type": "object",
  "additionalProperties": false,
  "required": ["v", "type", "runId", "retailer", "returnPath"],
  "properties": {
    "v": { "const": 1 },
    "type": { "enum": ["plan", "setup"] },
    "runId": {
      "type": "string",
      "pattern": "^[0-9a-fA-F]{8}-[0-9a-fA-F]{4}-[0-9a-fA-F]{4}-[0-9a-fA-F]{4}-[0-9a-fA-F]{12}$"
    },
    "retailer": { "enum": ["leclerc", "auchan"] },
    "store": {
      "type": "object",
      "additionalProperties": false,
      "required": ["id", "host"],
      "properties": {
        "id": { "type": "string", "minLength": 1, "maxLength": 40 },
        "host": { "type": "string", "minLength": 1, "maxLength": 255 }
      }
    },
    "returnPath": { "const": "/drive/retour" },
    "lines": {
      "description": "Obligatoire pour un plan, interdit pour un setup.",
      "type": "array",
      "maxItems": 100,
      "items": { "$ref": "#/definitions/line" }
    }
  },
  "allOf": [
    {
      "description": "Ce qui est propre à une enseigne (hôte, identifiant du magasin, forme des identifiants de produit et d'offre) ne vaut que pour les messages de cette enseigne (une entrée de plus par enseigne, STORES de check.ts).",
      "if": { "properties": { "retailer": { "const": "leclerc" } }, "required": ["retailer"] },
      "then": {
        "properties": {
          "store": {
            "type": "object",
            "properties": {
              "id": { "type": "string", "pattern": "^[0-9]{1,12}$" },
              "host": { "type": "string", "pattern": "^[a-z0-9-]+\\.leclercdrive\\.fr$" }
            }
          },
          "lines": {
            "description": "Leclerc n'a pas d'offre (StoreRules.offerId est null) : la clé offerId d'un produit est interdite. Ses identifiants de produit sont numériques.",
            "type": "array",
            "items": {
              "type": "object",
              "properties": {
                "products": {
                  "type": "array",
                  "items": {
                    "type": "object",
                    "properties": { "id": { "type": "string", "pattern": "^[0-9]{1,12}$" } },
                    "not": { "required": ["offerId"] }
                  }
                },
                "rejected": {
                  "type": "array",
                  "items": {
                    "type": "object",
                    "properties": { "id": { "type": "string", "pattern": "^[0-9]{1,12}$" } }
                  }
                },
                "replaces": {
                  "type": "object",
                  "properties": { "id": { "type": "string", "pattern": "^[0-9]{1,12}$" } }
                }
              }
            }
          }
        }
      }
    },
    {
      "if": { "properties": { "retailer": { "const": "auchan" } }, "required": ["retailer"] },
      "then": {
        "properties": {
          "store": {
            "description": "Le magasin d'Auchan ne se lit pas dans l'adresse : son identifiant est un UUID lu par l'agent, son hôte est celui du site (jamais compte.auchan.fr).",
            "type": "object",
            "properties": {
              "id": {
                "type": "string",
                "pattern": "^[0-9a-f]{8}-[0-9a-f]{4}-[0-9a-f]{4}-[0-9a-f]{4}-[0-9a-f]{12}$"
              },
              "host": { "type": "string", "pattern": "^www\\.auchan\\.fr$" }
            }
          },
          "lines": {
            "description": "Un produit d'Auchan a un identifiant de produit et un identifiant d'offre, tous deux des UUID en minuscules.",
            "type": "array",
            "items": {
              "type": "object",
              "properties": {
                "products": {
                  "type": "array",
                  "items": {
                    "type": "object",
                    "properties": {
                      "id": {
                        "type": "string",
                        "pattern": "^[0-9a-f]{8}-[0-9a-f]{4}-[0-9a-f]{4}-[0-9a-f]{4}-[0-9a-f]{12}$"
                      },
                      "offerId": {
                        "type": "string",
                        "pattern": "^[0-9a-f]{8}-[0-9a-f]{4}-[0-9a-f]{4}-[0-9a-f]{4}-[0-9a-f]{12}$"
                      }
                    }
                  }
                },
                "rejected": {
                  "type": "array",
                  "items": {
                    "type": "object",
                    "properties": {
                      "id": {
                        "type": "string",
                        "pattern": "^[0-9a-f]{8}-[0-9a-f]{4}-[0-9a-f]{4}-[0-9a-f]{4}-[0-9a-f]{12}$"
                      }
                    }
                  }
                },
                "replaces": {
                  "type": "object",
                  "properties": {
                    "id": {
                      "type": "string",
                      "pattern": "^[0-9a-f]{8}-[0-9a-f]{4}-[0-9a-f]{4}-[0-9a-f]{4}-[0-9a-f]{12}$"
                    }
                  }
                }
              }
            }
          }
        }
      }
    }
  ],
  "if": { "properties": { "type": { "const": "plan" } } },
  "then": { "required": ["lines", "store"] },
  "else": { "not": { "required": ["lines"] } },
  "definitions": {
    "label": { "type": "string", "minLength": 1, "maxLength": 255 },
    "productId": {
      "description": "La forme de l'identifiant d'un produit est celle de l'enseigne du message (allOf plus haut, productIdPattern du contrat des enseignes).",
      "type": "string",
      "minLength": 1,
      "maxLength": 40
    },
    "productRef": {
      "type": "object",
      "additionalProperties": false,
      "required": ["id", "label"],
      "properties": {
        "id": { "$ref": "#/definitions/productId" },
        "label": { "$ref": "#/definitions/label" }
      }
    },
    "product": {
      "description": "Un produit accepté, avec ses propres packs (les contenus diffèrent d'un produit à l'autre).",
      "type": "object",
      "additionalProperties": false,
      "required": ["id", "label"],
      "properties": {
        "id": { "$ref": "#/definitions/productId" },
        "label": { "$ref": "#/definitions/label" },
        "content": {
          "type": "object",
          "additionalProperties": false,
          "required": ["value", "unit"],
          "properties": {
            "value": { "type": "number", "exclusiveMinimum": 0 },
            "unit": { "enum": ["g", "kg", "ml", "cl", "l", "piece"] }
          }
        },
        "packs": { "type": ["integer", "null"], "minimum": 1, "maximum": 99 },
        "packsStatus": { "enum": ["COMPUTED", "TO_CHECK", null] },
        "offerId": {
          "description": "Facultatif (DRV-722) : l'identifiant de l'offre du produit dans le magasin, pour une enseigne dont un produit a deux identifiants. Sa forme est celle de l'enseigne du message (offerIdPattern du contrat des enseignes, une entrée par enseigne à offre dans allOf) ; une enseigne sans offre (Leclerc) l'interdit.",
          "type": "string",
          "minLength": 1,
          "maxLength": 40
        },
        "packSize": {
          "description": "Facultatif (DRV-652) : la contenance que la personne a donnée pour CE produit dans l'unité de la ligne (needed.unitSlug), null si elle n'a rien répondu. Quand elle est là, packs est déjà calculé avec elle.",
          "oneOf": [{ "$ref": "#/definitions/packSize" }, { "type": "null" }]
        }
      }
    },
    "packSize": {
      "description": "Combien d'unités de la liste tiennent dans un produit : « 20 tranches » est {value: 20, unitSlug: 'tranche'}. Trois décimales au plus (le schéma ne sait pas le dire, les validateurs le vérifient).",
      "type": "object",
      "additionalProperties": false,
      "required": ["value", "unitSlug"],
      "properties": {
        "value": { "type": "number", "minimum": 0.001, "maximum": 9999 },
        "unitSlug": { "type": "string", "pattern": "^[a-z0-9-]{1,255}$" }
      }
    },
    "needed": {
      "description": "Ce que la liste demande pour l'ingrédient, dans l'unité de la ligne. dimension et baseFactor permettent à l'agent de calculer le nombre de produits d'un produit qu'il ne connaissait pas.",
      "type": "object",
      "additionalProperties": false,
      "required": ["quantity", "unitSymbol"],
      "properties": {
        "quantity": { "type": "number", "exclusiveMinimum": 0, "maximum": 1000000 },
        "unitSymbol": { "type": "string", "minLength": 1, "maxLength": 32 },
        "dimension": { "enum": ["WEIGHT", "VOLUME", "COUNT", "PACKAGE", null] },
        "baseFactor": { "type": ["number", "null"], "exclusiveMinimum": 0, "maximum": 1000000 },
        "unitSlug": {
          "description": "Facultatif (DRV-652) : le slug de l'unité de la ligne, dans lequel une contenance se compte.",
          "type": "string",
          "pattern": "^[a-z0-9-]{1,255}$"
        },
        "unitName": {
          "description": "Facultatif (DRV-652) : le nom de l'unité de la ligne, au singulier (« tranche »). L'agent ne pose la question « combien de tranches » qu'avec unitSlug ET unitName.",
          "$ref": "#/definitions/label"
        }
      }
    },
    "line": {
      "type": "object",
      "additionalProperties": false,
      "required": ["ingredientSlug", "name", "status"],
      "properties": {
        "ingredientSlug": { "type": "string", "pattern": "^[a-z0-9-]{1,100}$" },
        "name": { "$ref": "#/definitions/label" },
        "status": { "enum": ["KNOWN", "NEW", "HAVE_AT_HOME", "SKIP"] },
        "products": {
          "description": "Classés par priorité (le premier est préféré), sans doublon.",
          "type": "array",
          "maxItems": 5,
          "items": { "$ref": "#/definitions/product" }
        },
        "rejected": {
          "description": "Les produits que l'utilisateur ne veut jamais.",
          "type": "array",
          "maxItems": 20,
          "items": { "$ref": "#/definitions/productRef" }
        },
        "searchQuery": { "$ref": "#/definitions/label" },
        "replaces": { "$ref": "#/definitions/productRef" },
        "needed": { "$ref": "#/definitions/needed" },
        "rayonHints": {
          "description": "Facultatif (DRV-642) : les rayons de l'enseigne où l'on prend d'habitude cet ingrédient, du plus choisi au moins choisi. Sert à ranger la liste de l'écran de choix ; aucun produit n'est caché.",
          "type": "array",
          "maxItems": 3,
          "items": { "type": "integer", "minimum": 1, "maximum": 2147483647 }
        }
      },
      "allOf": [
        {
          "if": { "properties": { "status": { "const": "KNOWN" } } },
          "then": {
            "required": ["products"],
            "properties": { "products": { "type": "array", "minItems": 1 } }
          }
        },
        {
          "if": { "properties": { "status": { "const": "NEW" } } },
          "then": { "properties": { "products": { "type": "array", "maxItems": 0 } } }
        }
      ]
    }
  }
}
