{
  "v": 1,
  "type": "plan",
  "runId": "__RUN_ID__",
  "retailer": "leclerc",
  "store": { "id": "000001", "host": "courses-test.leclercdrive.fr" },
  "returnPath": "/drive/retour",
  "lines": [
    {
      "ingredientSlug": "poivre",
      "name": "Poivre",
      "status": "NEW",
      "products": [],
      "rejected": [],
      "searchQuery": "poivre",
      "needed": { "quantity": 80, "unitSymbol": "g", "dimension": "WEIGHT", "baseFactor": 1 }
    },
    { "ingredientSlug": "sel", "name": "Sel", "status": "NEW", "products": [], "rejected": [], "searchQuery": "sel" },
    { "ingredientSlug": "riz", "name": "Riz", "status": "NEW", "products": [], "rejected": [], "searchQuery": "riz" },
    { "ingredientSlug": "huile", "name": "Huile", "status": "NEW", "products": [], "rejected": [], "searchQuery": "huile" }
  ]
}
