{
  "v": 1,
  "type": "plan",
  "runId": "8f14e45f-ceea-467a-9575-8e6b8c0a1b2c",
  "retailer": "auchan",
  "store": {
    "id": "0b5f8a2e-3c1d-4e7f-9a6b-123456789abc",
    "host": "www.auchan.fr"
  },
  "returnPath": "/drive/retour",
  "lines": [
    {
      "ingredientSlug": "farine",
      "name": "Farine",
      "status": "KNOWN",
      "products": [
        {
          "id": "1a2b3c4d-5e6f-4a7b-8c9d-0e1f2a3b4c5d",
          "label": "Farine de blé T55 de test 1 kg"
        },
        {
          "id": "2b3c4d5e-6f7a-4b8c-9d0e-1f2a3b4c5d6e",
          "label": "Farine de blé T45 de test 1 kg",
          "offerId": "4d5e6f7a-8b9c-4d0e-9f2a-3b4c5d6e7f80"
        }
      ]
    }
  ]
}
