{
  "v": 1,
  "type": "plan",
  "runId": "8f14e45f-ceea-467a-9575-8e6b8c0a1b2c",
  "retailer": "leclerc",
  "store": { "id": "000000", "host": "courses-test.leclercdrive.fr" },
  "returnPath": "/drive/retour",
  "lines": [
    { "ingredientSlug": "ingredient-0", "name": "Ingrédient 0", "status": "HAVE_AT_HOME" },
    { "ingredientSlug": "ingredient-1", "name": "Ingrédient 1", "status": "HAVE_AT_HOME" },
    { "ingredientSlug": "ingredient-2", "name": "Ingrédient 2", "status": "HAVE_AT_HOME" },
    { "ingredientSlug": "ingredient-3", "name": "Ingrédient 3", "status": "HAVE_AT_HOME" },
    { "ingredientSlug": "ingredient-4", "name": "Ingrédient 4", "status": "HAVE_AT_HOME" },
    { "ingredientSlug": "ingredient-5", "name": "Ingrédient 5", "status": "HAVE_AT_HOME" },
    { "ingredientSlug": "ingredient-6", "name": "Ingrédient 6", "status": "HAVE_AT_HOME" },
    { "ingredientSlug": "ingredient-7", "name": "Ingrédient 7", "status": "HAVE_AT_HOME" },
    { "ingredientSlug": "ingredient-8", "name": "Ingrédient 8", "status": "HAVE_AT_HOME" },
    { "ingredientSlug": "ingredient-9", "name": "Ingrédient 9", "status": "HAVE_AT_HOME" },
    { "ingredientSlug": "ingredient-10", "name": "Ingrédient 10", "status": "HAVE_AT_HOME" },
    { "ingredientSlug": "ingredient-11", "name": "Ingrédient 11", "status": "HAVE_AT_HOME" },
    { "ingredientSlug": "ingredient-12", "name": "Ingrédient 12", "status": "HAVE_AT_HOME" },
    { "ingredientSlug": "ingredient-13", "name": "Ingrédient 13", "status": "HAVE_AT_HOME" },
    { "ingredientSlug": "ingredient-14", "name": "Ingrédient 14", "status": "HAVE_AT_HOME" },
    { "ingredientSlug": "ingredient-15", "name": "Ingrédient 15", "status": "HAVE_AT_HOME" },
    { "ingredientSlug": "ingredient-16", "name": "Ingrédient 16", "status": "HAVE_AT_HOME" },
    { "ingredientSlug": "ingredient-17", "name": "Ingrédient 17", "status": "HAVE_AT_HOME" },
    { "ingredientSlug": "ingredient-18", "name": "Ingrédient 18", "status": "HAVE_AT_HOME" },
    { "ingredientSlug": "ingredient-19", "name": "Ingrédient 19", "status": "HAVE_AT_HOME" },
    { "ingredientSlug": "ingredient-20", "name": "Ingrédient 20", "status": "HAVE_AT_HOME" },
    { "ingredientSlug": "ingredient-21", "name": "Ingrédient 21", "status": "HAVE_AT_HOME" },
    { "ingredientSlug": "ingredient-22", "name": "Ingrédient 22", "status": "HAVE_AT_HOME" },
    { "ingredientSlug": "ingredient-23", "name": "Ingrédient 23", "status": "HAVE_AT_HOME" },
    { "ingredientSlug": "ingredient-24", "name": "Ingrédient 24", "status": "HAVE_AT_HOME" },
    { "ingredientSlug": "ingredient-25", "name": "Ingrédient 25", "status": "HAVE_AT_HOME" },
    { "ingredientSlug": "ingredient-26", "name": "Ingrédient 26", "status": "HAVE_AT_HOME" },
    { "ingredientSlug": "ingredient-27", "name": "Ingrédient 27", "status": "HAVE_AT_HOME" },
    { "ingredientSlug": "ingredient-28", "name": "Ingrédient 28", "status": "HAVE_AT_HOME" },
    { "ingredientSlug": "ingredient-29", "name": "Ingrédient 29", "status": "HAVE_AT_HOME" },
    { "ingredientSlug": "ingredient-30", "name": "Ingrédient 30", "status": "HAVE_AT_HOME" },
    { "ingredientSlug": "ingredient-31", "name": "Ingrédient 31", "status": "HAVE_AT_HOME" },
    { "ingredientSlug": "ingredient-32", "name": "Ingrédient 32", "status": "HAVE_AT_HOME" },
    { "ingredientSlug": "ingredient-33", "name": "Ingrédient 33", "status": "HAVE_AT_HOME" },
    { "ingredientSlug": "ingredient-34", "name": "Ingrédient 34", "status": "HAVE_AT_HOME" },
    { "ingredientSlug": "ingredient-35", "name": "Ingrédient 35", "status": "HAVE_AT_HOME" },
    { "ingredientSlug": "ingredient-36", "name": "Ingrédient 36", "status": "HAVE_AT_HOME" },
    { "ingredientSlug": "ingredient-37", "name": "Ingrédient 37", "status": "HAVE_AT_HOME" },
    { "ingredientSlug": "ingredient-38", "name": "Ingrédient 38", "status": "HAVE_AT_HOME" },
    { "ingredientSlug": "ingredient-39", "name": "Ingrédient 39", "status": "HAVE_AT_HOME" },
    { "ingredientSlug": "ingredient-40", "name": "Ingrédient 40", "status": "HAVE_AT_HOME" },
    { "ingredientSlug": "ingredient-41", "name": "Ingrédient 41", "status": "HAVE_AT_HOME" },
    { "ingredientSlug": "ingredient-42", "name": "Ingrédient 42", "status": "HAVE_AT_HOME" },
    { "ingredientSlug": "ingredient-43", "name": "Ingrédient 43", "status": "HAVE_AT_HOME" },
    { "ingredientSlug": "ingredient-44", "name": "Ingrédient 44", "status": "HAVE_AT_HOME" },
    { "ingredientSlug": "ingredient-45", "name": "Ingrédient 45", "status": "HAVE_AT_HOME" },
    { "ingredientSlug": "ingredient-46", "name": "Ingrédient 46", "status": "HAVE_AT_HOME" },
    { "ingredientSlug": "ingredient-47", "name": "Ingrédient 47", "status": "HAVE_AT_HOME" },
    { "ingredientSlug": "ingredient-48", "name": "Ingrédient 48", "status": "HAVE_AT_HOME" },
    { "ingredientSlug": "ingredient-49", "name": "Ingrédient 49", "status": "HAVE_AT_HOME" },
    { "ingredientSlug": "ingredient-50", "name": "Ingrédient 50", "status": "HAVE_AT_HOME" },
    { "ingredientSlug": "ingredient-51", "name": "Ingrédient 51", "status": "HAVE_AT_HOME" },
    { "ingredientSlug": "ingredient-52", "name": "Ingrédient 52", "status": "HAVE_AT_HOME" },
    { "ingredientSlug": "ingredient-53", "name": "Ingrédient 53", "status": "HAVE_AT_HOME" },
    { "ingredientSlug": "ingredient-54", "name": "Ingrédient 54", "status": "HAVE_AT_HOME" },
    { "ingredientSlug": "ingredient-55", "name": "Ingrédient 55", "status": "HAVE_AT_HOME" },
    { "ingredientSlug": "ingredient-56", "name": "Ingrédient 56", "status": "HAVE_AT_HOME" },
    { "ingredientSlug": "ingredient-57", "name": "Ingrédient 57", "status": "HAVE_AT_HOME" },
    { "ingredientSlug": "ingredient-58", "name": "Ingrédient 58", "status": "HAVE_AT_HOME" },
    { "ingredientSlug": "ingredient-59", "name": "Ingrédient 59", "status": "HAVE_AT_HOME" },
    { "ingredientSlug": "ingredient-60", "name": "Ingrédient 60", "status": "HAVE_AT_HOME" },
    { "ingredientSlug": "ingredient-61", "name": "Ingrédient 61", "status": "HAVE_AT_HOME" },
    { "ingredientSlug": "ingredient-62", "name": "Ingrédient 62", "status": "HAVE_AT_HOME" },
    { "ingredientSlug": "ingredient-63", "name": "Ingrédient 63", "status": "HAVE_AT_HOME" },
    { "ingredientSlug": "ingredient-64", "name": "Ingrédient 64", "status": "HAVE_AT_HOME" },
    { "ingredientSlug": "ingredient-65", "name": "Ingrédient 65", "status": "HAVE_AT_HOME" },
    { "ingredientSlug": "ingredient-66", "name": "Ingrédient 66", "status": "HAVE_AT_HOME" },
    { "ingredientSlug": "ingredient-67", "name": "Ingrédient 67", "status": "HAVE_AT_HOME" },
    { "ingredientSlug": "ingredient-68", "name": "Ingrédient 68", "status": "HAVE_AT_HOME" },
    { "ingredientSlug": "ingredient-69", "name": "Ingrédient 69", "status": "HAVE_AT_HOME" },
    { "ingredientSlug": "ingredient-70", "name": "Ingrédient 70", "status": "HAVE_AT_HOME" },
    { "ingredientSlug": "ingredient-71", "name": "Ingrédient 71", "status": "HAVE_AT_HOME" },
    { "ingredientSlug": "ingredient-72", "name": "Ingrédient 72", "status": "HAVE_AT_HOME" },
    { "ingredientSlug": "ingredient-73", "name": "Ingrédient 73", "status": "HAVE_AT_HOME" },
    { "ingredientSlug": "ingredient-74", "name": "Ingrédient 74", "status": "HAVE_AT_HOME" },
    { "ingredientSlug": "ingredient-75", "name": "Ingrédient 75", "status": "HAVE_AT_HOME" },
    { "ingredientSlug": "ingredient-76", "name": "Ingrédient 76", "status": "HAVE_AT_HOME" },
    { "ingredientSlug": "ingredient-77", "name": "Ingrédient 77", "status": "HAVE_AT_HOME" },
    { "ingredientSlug": "ingredient-78", "name": "Ingrédient 78", "status": "HAVE_AT_HOME" },
    { "ingredientSlug": "ingredient-79", "name": "Ingrédient 79", "status": "HAVE_AT_HOME" },
    { "ingredientSlug": "ingredient-80", "name": "Ingrédient 80", "status": "HAVE_AT_HOME" },
    { "ingredientSlug": "ingredient-81", "name": "Ingrédient 81", "status": "HAVE_AT_HOME" },
    { "ingredientSlug": "ingredient-82", "name": "Ingrédient 82", "status": "HAVE_AT_HOME" },
    { "ingredientSlug": "ingredient-83", "name": "Ingrédient 83", "status": "HAVE_AT_HOME" },
    { "ingredientSlug": "ingredient-84", "name": "Ingrédient 84", "status": "HAVE_AT_HOME" },
    { "ingredientSlug": "ingredient-85", "name": "Ingrédient 85", "status": "HAVE_AT_HOME" },
    { "ingredientSlug": "ingredient-86", "name": "Ingrédient 86", "status": "HAVE_AT_HOME" },
    { "ingredientSlug": "ingredient-87", "name": "Ingrédient 87", "status": "HAVE_AT_HOME" },
    { "ingredientSlug": "ingredient-88", "name": "Ingrédient 88", "status": "HAVE_AT_HOME" },
    { "ingredientSlug": "ingredient-89", "name": "Ingrédient 89", "status": "HAVE_AT_HOME" },
    { "ingredientSlug": "ingredient-90", "name": "Ingrédient 90", "status": "HAVE_AT_HOME" },
    { "ingredientSlug": "ingredient-91", "name": "Ingrédient 91", "status": "HAVE_AT_HOME" },
    { "ingredientSlug": "ingredient-92", "name": "Ingrédient 92", "status": "HAVE_AT_HOME" },
    { "ingredientSlug": "ingredient-93", "name": "Ingrédient 93", "status": "HAVE_AT_HOME" },
    { "ingredientSlug": "ingredient-94", "name": "Ingrédient 94", "status": "HAVE_AT_HOME" },
    { "ingredientSlug": "ingredient-95", "name": "Ingrédient 95", "status": "HAVE_AT_HOME" },
    { "ingredientSlug": "ingredient-96", "name": "Ingrédient 96", "status": "HAVE_AT_HOME" },
    { "ingredientSlug": "ingredient-97", "name": "Ingrédient 97", "status": "HAVE_AT_HOME" },
    { "ingredientSlug": "ingredient-98", "name": "Ingrédient 98", "status": "HAVE_AT_HOME" },
    { "ingredientSlug": "ingredient-99", "name": "Ingrédient 99", "status": "HAVE_AT_HOME" }
  ]
}
